Symbol,Name,Last Sale,Net Change,% Change,Market Cap,Country,IPO Year,Volume,Sector,Industry
DBI,Designer Brands Inc. Class A Common Stock,$11.16,-0.65,-5.50%,807904507,United States,,3093815,Consumer Services,Clothing/Shoe/Accessory Stores
DBL,DoubleLine Opportunistic Credit Fund Common Shares of Beneficial Interest,$19.68,-0.12,-0.61%,294351713,United States,2012,36664,,
DBOC,Innovator Double Stacker 9 Buffer ETF - October,$27.4206,0.0613,0.22%,0,,2020,6211,,
DBVT,DBV Technologies S.A. American Depositary Shares,$5.74,0.17,3.05%,629297840,France,2014,413028,Health Care,Biotechnology: Biological Products (No Diagnostic Substances)
DBX,Dropbox Inc. Class A Common Stock,$22.20,0.18,0.82%,9182302684,United States,2018,5444162,Technology,Computer Software: Prepackaged Software
DCBO,Docebo Inc. Common Shares,$50.90,-2.42,-4.54%,1659096036,Canada,,92293,Technology,Computer Software: Prepackaged Software
DCF,BNY Mellon Alcentra Global Credit Income 2024 Target Term Fund Inc. Common Stock,$8.78,0.04,0.46%,131376299,,2017,24105,,
DCI,Donaldson Company Inc. Common Stock,$60.56,0.36,0.60%,7645089495,United States,,573535,Capital Goods,Pollution Control Equipment
DCO,Ducommun Incorporated Common Stock,$54.00,-2.19,-3.90%,632587860,United States,,45641,Capital Goods,Military/Government/Technical
DCOM,Dime Community Bancshares Inc. Common Stock,$18.74,1.12,6.36%,619316934,United States,,379520,Finance,Savings Institutions
DCOMP,Dime Community Bancshares Inc. 5.50% Fixed-Rate Non-Cumulative Perpetual Preferred Stock Series A,$25.09,-0.5912,-2.30%,0,United States,,1604,Finance,Savings Institutions
DCP,DCP Midstream  LP Common Units ,$19.77,-0.16,-0.80%,4119109709,United States,,933314,Public Utilities,Natural Gas Distribution
DCP.PRB,DCP Midstream LP,NA,,,,,,0,,
DCP.PRC,DCP Midstream LP,NA,,,,,,0,,
DCPH,Deciphera Pharmaceuticals Inc. Common Stock,$46.03,-2.04,-4.24%,2620645507,United States,2017,398805,Health Care,Major Pharmaceuticals
DCRB,Decarbonization Plus Acquisition Corporation Class A Common Stock,$13.92,0.04,0.29%,394249228,United States,2020,247055,Finance,Business Services
DCRBU,Decarbonization Plus Acquisition Corporation Unit,$15.47,-0.07,-0.45%,0,United States,2020,13519,Finance,Business Services
DCRBW,Decarbonization Plus Acquisition Corporation Warrant,$3.485,-0.2648,-7.06%,0,United States,2020,126539,Finance,Business Services
DCRN,Decarbonization Plus Acquisition Corporation II,NA,,,,United States,,0,,
DCRNU,Decarbonization Plus Acquisition Corporation II Unit,NA,,,,United States,,0,,
DCRNW,Decarbonization Plus Acquisition Corporation II,NA,,,,United States,,0,,
DCT,Duck Creek Technologies Inc. Common Stock,$52.85,0.93,1.79%,6918998120,United States,2020,288363,Technology,Computer Software: Prepackaged Software
DCTH,Delcath Systems Inc. Common Stock,$17.50,0.61,3.61%,101426238,United States,,193088,Health Care,Medical/Dental Instruments
DCUE,Dominion Energy Inc. 2019 Series A Corporate Units,$98.90,0.35,0.36%,0,United States,2019,76912,Public Utilities,Electric Utilities: Central
DD,DuPont de Nemours Inc. Common Stock,$79.83,-1.52,-1.87%,58583213967,,2017,26749967,Basic Industries,Major Chemicals
DDD,3D Systems Corporation Common Stock,$37.19,0.68,1.86%,4616838563,United States,,8268643,Technology,Computer Software: Prepackaged Software
DDEC,FT Cboe Vest U.S. Equity Deep Buffer ETF - December,$30.6541,-0.0559,-0.18%,,United States,2020,77541,,
DDF,Delaware Investments Dividend & Income Fund Inc. Common Stock,$9.46,-0.03,-0.32%,72729975,United States,1993,16374,,
DDMX,DD3 Acquisition Corp. II Class A Common Stock,NA,,,,Mexico,,0,,
DDMXU,DD3 Acquisition Corp. II Unit,$10.70,-0.15,-1.38%,0,Mexico,2020,44954,Finance,Business Services
DDMXW,DD3 Acquisition Corp. II Warrant,NA,,,,Mexico,,0,,
DDOG,Datadog Inc. Class A Common Stock,$103.52,-5.45,-5.00%,31525188768,United States,2019,2567176,Technology,Computer Software: Prepackaged Software
DDS,Dillard's Inc. Common Stock,$104.46,17.28,19.82%,2297899798,United States,,1261033,Consumer Services,Department/Specialty Retail Stores
DDT,Dillard's Capital Trust I,$25.50,0.01,0.04%,0,United States,,21671,Consumer Services,Department/Specialty Retail Stores
DE,Deere & Company Common Stock,$296.01,-2.19,-0.73%,93071862037,United States,,1364350,Capital Goods,Industrial Machinery/Components
DEA,Easterly Government Properties Inc. Common Stock,$23.55,0.34,1.47%,1912998646,United States,2015,335324,Consumer Services,Real Estate Investment Trusts
DECK,Deckers Outdoor Corporation Common Stock,$304.23,-10.14,-3.23%,8544013574,United States,1993,304030,Consumer Non-Durables,Shoe Manufacturing
DECZ,TrueShares Structured Outcome (December) ETF,$25.8943,-0.0249,-0.10%,,United States,2020,1,,
DEFN,Emles Trust Emles Protective Allocation ETF,$24.9324,0.0024,0.01%,,,2020,0,,
DEH,D8 Holdings Corp. Class A Ordinary Shares,$10.29,-0.06,-0.58%,443756250,Hong Kong,2020,241271,Finance,Business Services
DEH.U,D8 Holdings Corp. Units each consisting of one Class A ordinary share and one-half of one redeemable warrant,NA,,,,Hong Kong,2020,0,,
DEH.WS,D8 Holdings Corp. Warrants each whole warrant exercisable for one Class A ordinary share at an exercise price of $11.50 per share,NA,,,,Hong Kong,,0,,
DEI,Douglas Emmett Inc. Common Stock,$28.71,-0.07,-0.24%,5035012977,United States,2006,634385,Consumer Services,Real Estate Investment Trusts
DELL,Dell Technologies Inc. Class C Common Stock ,$76.04,0.36,0.48%,57015124903,,2018,1277455,Technology,Computer Manufacturing
DEN,Denbury Inc. Common Stock,$30.62,-1.88,-5.79%,1530999969,,2020,791072,Energy,Oil & Gas Production
DENN,Denny's Corporation Common Stock,$15.61,-0.37,-2.32%,995420353,United States,,542485,Consumer Services,Restaurants
DEO,Diageo plc Common Stock,$161.09,2.5,1.58%,94215522839,United Kingdom,,529606,Consumer Non-Durables,Beverages (Production/Distribution)
DESP,Despegar.com Corp. Ordinary Shares,$10.94,0.05,0.46%,765209240,,2017,239935,Consumer Services,Transportation Services
DEX,Delaware Enhanced Global Dividend Common Shares of Beneficial Interest,$9.65,-0.03,-0.31%,115870792,United States,2007,97915,,
DFEB,FT Cboe Vest U.S. Equity Deep Buffer ETF - February,$32.59,-0.07,-0.21%,,United States,2020,25620,,
DFFN,Diffusion Pharmaceuticals Inc. Common Stock,$1.27,-0.03,-2.31%,81299610,United States,,2142431,Health Care,Major Pharmaceuticals
DFH,Dream Finders Homes Inc. Class A Common Stock,$23.06,1.56,7.26%,2100338975,United States,2021,802173,Capital Goods,Homebuilding
DFHT,Deerfield Healthcare Technology Acquisitions Corp. Class A Common Stock,$15.04,-0.48,-3.09%,270250000,United States,2020,169054,Finance,Business Services
DFHTU,Deerfield Healthcare Technology Acquisitions Corp. Unit,$16.60,0,0.00%,0,United States,2020,129,Finance,Business Services
DFHTW,Deerfield Healthcare Technology Acquisitions Corp. Warrant,$4.17,0.17,4.25%,0,United States,2020,854,Finance,Business Services
DFHY,TrimTabs Donoghue Forlines Tactical High Yield ETF,$25.1748,-0.0002,0.00%,,,2020,11233,,
DFIN,Donnelley Financial Solutions Inc. Common Stock ,$18.13,-0.46,-2.47%,605095458,,2016,143688,Consumer Services,Other Consumer Services
DFNS,LGL Systems Acquisition Corp. Common Stock,$10.76,-0.14,-1.28%,232012500,United States,2020,109938,Finance,Business Services
DFNS.U,LGL Systems Acquisition Corp. Units,NA,,,,United States,2020,0,,
DFNS.WS,LGL Systems Acquisition Corp. Redeemable Warrants each whole warrant exercisable for shares of Class A Common Stock at an exercise price of $11.50 per share,NA,,,,United States,,0,,
DFNV,TrimTabs Donoghue Forlines Risk Managed Innovation ETF,$27.0424,-0.1939,-0.71%,,,2020,8644,,
DFP,Flaherty & Crumrine Dynamic Preferred and Income Fund Inc. Common Stock,$28.54,-0.08,-0.28%,547162002,,2013,62398,,
DFPH,DFP Healthcare Acquisitions Corp. Class A Common Stock,$11.11,0.06,0.54%,319412500,United States,2020,211242,Finance,Business Services
DFPHU,DFP Healthcare Acquisitions Corp. Unit,$11.47,0,0.00%,0,United States,2020,0,Finance,Business Services
DFPHW,DFP Healthcare Acquisitions Corp. Warrant,$1.90,-0.07,-3.55%,0,United States,2020,4077,Finance,Business Services
DFS,Discover Financial Services Common Stock,$86.82,-2.24,-2.52%,26653740000,United States,,2235661,Finance,Finance: Consumer Services
DG,Dollar General Corporation Common Stock,$206.12,-0.45,-0.22%,50499586126,United States,2009,1472522,Consumer Services,Department/Specialty Retail Stores
DGICA,Donegal Group Inc. Class A Common Stock,$14.05,-0.11,-0.78%,418296108,United States,,38556,Finance,Property-Casualty Insurers
DGICB,Donegal Group Inc. Class B Common Stock,$12.0166,-0.0234,-0.19%,357757795,United States,1986,562,Finance,Property-Casualty Insurers
DGII,Digi International Inc. Common Stock,$20.11,0.23,1.16%,595655545,United States,1989,135084,Technology,Computer Communications Equipment
DGLY,Digital Ally Inc. Common Stock,$2.75,0.21,8.27%,82558275,United States,,21094275,Technology,Radio And Television Broadcasting And Communications Equipment
DGNR,Dragoneer Growth Opportunities Corp. Class A Ordinary Shares,$14.25,-0.45,-3.06%,1229062500,United States,2020,210981,Finance,Business Services
DGNR.U,Dragoneer Growth Opportunities Corp. Units each consisting of one Class A ordinary share and one-fourth of one redeemable warrant,NA,,,,United States,2020,0,,
DGNR.WS,Dragoneer Growth Opportunities Corp. Redeemable warrants each whole warrant exercisable for one Class A ordinary share at an exercise price of $11.50,NA,,,,United States,,0,,
DGNS,Dragoneer Growth Opportunities Corp. II Class A Ordinary Shares,$12.21,-0.54,-4.24%,385591800,United States,2020,277879,Finance,Business Services
DGX,Quest Diagnostics Incorporated Common Stock,$125.99,1.02,0.82%,16979166324,United States,,965636,Health Care,Medical Specialities
DHC,Diversified Healthcare Trust Common Shares of Beneficial Interest,$4.27,-0.08,-1.84%,1017406401,United States,,933611,Consumer Services,Real Estate Investment Trusts
DHCNI,Diversified Healthcare Trust 5.625% Senior Notes due 2042,$23.67,-0.13,-0.55%,0,United States,,15224,Consumer Services,Real Estate Investment Trusts
DHCNL,Diversified Healthcare Trust 6.25% Senior Notes Due 2046,$24.25,-0.2104,-0.86%,0,United States,,25734,Consumer Services,Real Estate Investment Trusts
DHF,BNY Mellon High Yield Strategies Fund Common Stock,$2.98,0.01,0.34%,216668910,United States,1998,211465,,
DHHCU,DiamondHead Holdings Corp. Unit,$10.80,0.8,8.00%,0,United States,2021,9407077,Finance,Business Services
DHI,D.R. Horton Inc. Common Stock,$77.79,-1.18,-1.49%,28364336275,United States,,4990181,Capital Goods,Homebuilding
DHIL,Diamond Hill Investment Group Inc. Class A Common Stock,$151.82,-0.79,-0.52%,480247044,United States,,11011,Finance,Investment Managers
DHR,Danaher Corporation Common Stock,$233.98,-4.17,-1.75%,1.66214E+11,United States,,1643263,Capital Goods,Industrial Machinery/Components
DHR.PRA,Danaher Corporation,NA,,,,,,0,,
DHR.PRB,Danaher Corporation,NA,,,,,,0,,
DHT,DHT Holdings Inc.,$5.42,0.04,0.74%,925726938,Jersey,2005,2145302,Transportation,Marine Transportation
DHX,DHI Group Inc. Common Stock,$2.62,-0.01,-0.38%,137385742,United States,2007,144987,Miscellaneous,Business Services
DHY,Credit Suisse High Yield Bond Fund Common Stock,$2.30,0.01,0.44%,238067025,United States,1998,901863,,
DIAX,Nuveen Dow 30SM Dynamic Overwrite Fund Common Shares of Beneficial Interest,$14.95,-0.08,-0.53%,543685349,,2014,97734,,
DIN,Dine Brands Global Inc. Common Stock,$73.51,-2.46,-3.24%,1206942239,United States,,416336,Consumer Services,Restaurants
DIOD,Diodes Incorporated Common Stock,$77.23,-1.65,-2.09%,4019200802,United States,,239429,Technology,Semiconductors
DIS,Walt Disney Company (The) Common Stock,$169.56,-2.33,-1.36%,3.07627E+11,United States,,7523199,Consumer Services,Services-Misc. Amusement & Recreation
DISCA,Discovery Inc. Series A Common Stock,$40.72,1.72,4.41%,19999722552,United States,,12857739,Consumer Services,Television Services
DISCB,Discovery Inc. Series B Common Stock,$39.20,0.79,2.06%,19253171022,United States,,887,Consumer Services,Television Services
DISCK,Discovery Inc. Series C Common Stock,$35.40,1.24,3.63%,17386792199,United States,,6194523,Consumer Services,Television Services
DISH,DISH Network Corporation Class A Common Stock,$31.56,0.86,2.80%,16600827219,United States,1995,13835473,Consumer Services,Television Services
DIT,AMCON Distributing Company Common Stock,$130.3246,-3.5854,-2.68%,71856944,United States,,2578,Consumer Non-Durables,Food Distributors
DJAN,FT Cboe Vest U.S. Equity Deep Buffer ETF - January,$30.2879,-0.0021,-0.01%,,United States,2021,65197,,
DJCO,Daily Journal Corp. (S.C.) Common Stock,$336.65,1.55,0.46%,464828141,United States,,3052,Consumer Services,Newspapers/Magazines
DJUL,FT Cboe Vest U.S. Equity Deep Buffer ETF - July,$31.815,0.0443,0.14%,,United States,2020,158,,
DJUN,FT Cboe Vest U.S. Equity Deep Buffer ETF - June,$32.511,0.0559,0.17%,,United States,2020,31851,,
DK,Delek US Holdings Inc. Common Stock,$20.22,-1.13,-5.29%,1490734827,United States,2017,1120873,Energy,Integrated oil Companies
DKL,Delek Logistics Partners L.P. Common Units representing Limited Partner Interests,$40.01,0.51,1.29%,1737763892,United States,2012,90885,Energy,Natural Gas Distribution
DKNG,DraftKings Inc. Class A Common Stock,$54.06,2.77,5.40%,21176049434,United States,2019,24225763,Consumer Services,Services-Misc. Amusement & Recreation
DKS,Dick's Sporting Goods Inc Common Stock,$68.55,-0.05,-0.07%,6141989171,United States,2002,1954700,Consumer Services,Other Specialty Stores
DL,China Distance Education Holdings Limited American Depositary Shares,$9.60,0,0.00%,324769037,China,,2349,Consumer Services,Other Consumer Services
DLA,Delta Apparel Inc. Common Stock,$20.83,0.26,1.26%,145282168,United States,,6241,Consumer Non-Durables,Apparel
DLB,Dolby Laboratories Common Stock,$93.22,-1.36,-1.44%,9409142149,United States,2005,903662,Miscellaneous,Multi-Sector Companies
DLCAU,Deep Lake Capital Acquisition Corp. Unit,$10.77,-0.13,-1.19%,0,United States,2021,174243,Finance,Business Services
DLHC,DLH Holdings Corp.,$10.50,0.08,0.77%,131585013,United States,,33001,Technology,Professional Services
DLNG,Dynagas LNG Partners LP Common Units,$2.63,-0.03,-1.13%,93661085,Greece,,98229,Consumer Services,Marine Transportation
DLNG.PRA,Dynagas LNG Partners LP,NA,,,,,,0,,
DLNG.PRB,Dynagas LNG Partners LP,NA,,,,,,0,,
DLPN,Dolphin Entertainment Inc. Common Stock,$4.05,-0.01,-0.25%,26569385,United States,,283347,Consumer Services,Other Consumer Services
DLR,Digital Realty Trust Inc. Common Stock,$145.85,3.22,2.26%,40862091941,United States,2004,1167144,Consumer Services,Real Estate Investment Trusts
DLR.PRC,Digital Realty Trust Inc.,NA,,,,,,0,,
DLR.PRJ,Digital Realty Trust Inc.,NA,,,,,,0,,
DLR.PRK,Digital Realty Trust Inc.,NA,,,,,,0,,
DLR.PRL,Digital Realty Trust Inc.,NA,,,,,,0,,
DLTH,Duluth Holdings Inc. Class B Common Stock,$12.86,0.15,1.18%,422170601,United States,2015,167883,Consumer Services,Clothing/Shoe/Accessory Stores
DLTR,Dollar Tree Inc. Common Stock,$105.70,-0.67,-0.63%,24859810466,United States,1995,1545622,Consumer Services,Department/Specialty Retail Stores
DLX,Deluxe Corporation Common Stock,$35.00,1.16,3.43%,1466289580,United States,,536973,Consumer Durables,Publishing
DLY,DoubleLine Yield Opportunities Fund Common Shares of Beneficial Interest,$18.88,-0.15,-0.79%,0,,2020,145655,,
DM,Desktop Metal Inc. Class A Common Stock,$26.32,0.09,0.34%,5966875100,,2019,2921782,Technology,Industrial Machinery/Components
DM.WS,Desktop Metal Inc. Warrants,NA,,,,,,0,,
DMAC,DiaMedica Therapeutics Inc. Common Stock,$8.42,-0.89,-9.56%,157783003,United States,2018,259315,Health Care,Major Pharmaceuticals
DMAY,FT Cboe Vest U.S. Equity Deep Buffer ETF - May,$32.8448,-0.005,-0.02%,,United States,2020,15758,,
DMB,BNY Mellon Municipal Bond Infrastructure Fund Inc. Common Stock,$14.50,0.04,0.28%,266619809,,2013,41293,,
DMF,BNY Mellon Municipal Income Inc. Common Stock,$8.88,0,0.00%,184267086,United States,1988,29846,,
DMLP,Dorchester Minerals L.P. Common Units Representing Limited Partnership Interests,$12.74,0.14,1.11%,441820321,United States,,74457,Energy,Oil & Gas Production
DMO,Western Asset Mortgage Opportunity Fund Inc. Common Stock,$14.34,0.11,0.77%,157511679,United States,2010,63609,,
DMRC,Digimarc Corporation Common Stock,$39.24,-3.17,-7.48%,648002454,United States,,193349,Technology,EDP Services
DMS,Digital Media Solutions Inc. Class A Ordinary Shares,$11.07,0.57,5.43%,646399894,United States,2018,114934,Miscellaneous,Business Services
DMS.WS,Digital Media Solutions Inc. Warrants ,NA,,,,United States,,0,,
DMTK,DermTech Inc. Common Stock,$39.87,-5.61,-12.34%,1013494563,United States,2017,1775591,Health Care,Medical Specialities
DMYD,dMY Technology Group Inc. II Class A Common Stock,$19.38,1.23,6.78%,668610000,United States,2020,1140018,Finance,Business Services
DMYD.U,dMY Technology Group Inc. II Units each consisting of one share of Class A common stock and one-third of one redeemable warrant,NA,,,,United States,2020,0,,
DMYD.WS,dMY Technology Group Inc. II Redeemable Warrants,NA,,,,United States,,0,,
DMYI,dMY Technology Group Inc. III Class A Common Stock,$11.91,-0.18,-1.49%,451463438,United States,2021,695021,Finance,Business Services
DMYI.U,dMY Technology Group Inc. III Units each consisting of one share of Class A common stock and one-fourth of one redeemable warrant,NA,,,,United States,2020,0,,
DMYI.WS,dMY Technology Group Inc. III Redeemable warrants each whole warrant exercisable for one share of Class A common stock each at an exercise price of $11.50 per share,NA,,,,United States,,0,,
DNB,Dun & Bradstreet Holdings Inc. Common Stock,$24.25,-0.34,-1.38%,10258697908,United States,2020,1160296,Finance,Finance: Consumer Services
DNK,Phoenix Tree Holdings Limited American Depositary Shares each representing ten (10) Class A ordinary shares,$2.87,-0.01,-0.35%,524865600,,2020,161568,Consumer Services,Building operators
DNLI,Denali Therapeutics Inc. Common Stock,$72.98,-8.55,-10.49%,8751651838,United States,2017,520119,Health Care,Biotechnology: Biological Products (No Diagnostic Substances)
DNMR,Danimer Scientific Inc. Common Stock,$48.00,5.44,12.78%,4114779360,,2020,3185909,Basic Industries,Major Chemicals
DNMR.WS,Danimer Scientific Inc. Redeemable Warrants,NA,,,,,,0,,
DNN,Denison Mines Corp Ordinary Shares (Canada),$0.6902,0.0102,1.50%,468473124,Canada,,4424135,Basic Industries,Precious Metals
DNOV,FT Cboe Vest U.S. Equity Deep Buffer ETF - November,$33.54,-0.07,-0.21%,,United States,2019,10138,,
DNOW,NOW Inc. Common Stock,$8.10,-0.01,-0.12%,885974979,,2014,2332702,Energy,Metal Fabrications
DNP,DNP Select Income Fund Inc. Common Stock,$10.48,0.08,0.77%,3241490714,United States,1987,536389,,
DNZ.U,D and Z Media Acquisition Corp. Units each consisting of one share of Class A Common Stock and one-third of one Warrant,NA,,,,,2021,0,,
DOC,Physicians Realty Trust Common Shares of Beneficial Interest,$18.28,0.1,0.55%,3806439867,United States,2013,1100921,Consumer Services,Real Estate Investment Trusts
DOCT,FT Cboe Vest U.S. Equity Deep Buffer ETF - October,$31.0848,-0.0028,-0.01%,,United States,2020,3232,,
DOCU,DocuSign Inc. Common Stock,$235.11,-9.29,-3.80%,44966413991,United States,2018,2746035,Technology,Computer Software: Prepackaged Software
DOGZ,Dogness (International) Corporation Class A Common Stock,$2.02,0,0.00%,59324897,China,2017,433343,Consumer Durables,Miscellaneous manufacturing industries
DOMO,Domo Inc. Class B Common Stock,$66.90,-3.45,-4.90%,2003605962,United States,2018,259641,Technology,Computer Software: Prepackaged Software
DOOO,BRP Inc. (Recreational Products) Common Subordinate Voting Shares,$69.37,0.53,0.77%,6099019418,Canada,,48775,Capital Goods,Industrial Specialties
DOOR,Masonite International Corporation Ordinary Shares (Canada),$105.31,-1.75,-1.64%,2580407455,Canada,,207781,Basic Industries,Forest Products
DORM,Dorman Products Inc. Common Stock,$99.34,0.24,0.24%,3207360480,United States,,77445,Capital Goods,Auto Parts:O.E.M.
DOV,Dover Corporation Common Stock,$124.25,-0.82,-0.66%,17904834901,United States,,744533,Technology,Industrial Machinery/Components
DOW,Dow Inc. Common Stock ,$55.74,-1.49,-2.60%,41345243214,,2019,3060282,Basic Industries,Major Chemicals
DOX,Amdocs Limited Ordinary Shares,$71.49,-0.17,-0.24%,9373066911,Guernsey,,437832,Technology,EDP Services
DOYU,DouYu International Holdings Limited ADS,$13.54,-0.09,-0.66%,4345616287,China,2019,6717222,Technology,Computer Software: Programming Data Processing
DPG,Duff & Phelps Utility and Infrastructure Fund Inc.,$13.04,0.1,0.77%,494604670,United States,2011,91318,,
DPW,Ault Global Holdings Inc. Common Stock,$5.29,0.3,6.01%,146816343,United States,,6353668,Capital Goods,Industrial Machinery/Components
DPZ,Domino's Pizza Inc Common Stock,$378.84,0.35,0.09%,14926260389,United States,2004,581595,Consumer Non-Durables,Food Distributors
DQ,DAQO New Energy Corp. American Depositary Shares each representing five ordinary shares,$101.89,5.75,5.98%,7079707439,China,2010,2732002,Technology,Semiconductors
DRD,DRDGOLD Limited American Depositary Shares,$10.78,0.09,0.84%,921812666,South Africa,,211108,Basic Industries,Precious Metals
DRE,Duke Realty Corporation Common Stock,$40.84,0.75,1.87%,15190485824,United States,,2255404,Consumer Services,Real Estate Investment Trusts
DRH,Diamondrock Hospitality Company Common Stock,$8.59,-0.12,-1.38%,1713867179,United States,2005,2312796,Consumer Services,Real Estate Investment Trusts
DRH.PRA,Diamondrock Hospitality Company,NA,,,,,,0,,
DRI,Darden Restaurants Inc. Common Stock,$118.58,-1.42,-1.18%,15454314043,United States,,1735423,Consumer Services,Restaurants
DRIO,DarioHealth Corp. Common Stock,$23.49,0.42,1.82%,216312363,Israel,,141332,Health Care,Medical/Dental Instruments
DRIOW,DarioHealth Corp. Warrant,$0.27,0.0901,50.08%,0,Israel,,295155,Health Care,Medical/Dental Instruments
DRNA,Dicerna Pharmaceuticals Inc. Common Stock,$25.55,-0.25,-0.97%,1917397093,United States,2014,706355,Health Care,Major Pharmaceuticals
DRQ,Dril-Quip Inc. Common Stock,$31.98,-0.2,-0.62%,1122363524,United States,1997,143010,Energy,Metal Fabrications
DRRX,DURECT Corporation Common Stock,$2.30,-0.09,-3.77%,467312296,United States,2000,645515,Health Care,Major Pharmaceuticals
DRTT,DIRTT Environmental Solutions Ltd. Common Shares,$2.32,0,0.00%,196460764,Canada,,169005,Technology,Computer Software: Prepackaged Software
DRUA,Dominion Energy Inc. 2016 Series A 5.25% Enhanced Junior Subordinated Notes due 2076,$26.01,0,0.00%,0,United States,2016,16187,Public Utilities,Electric Utilities: Central
DRVN,Driven Brands Holdings Inc. Common Stock,$30.07,0.09,0.30%,4952816379,United States,2021,601923,Consumer Services,Automotive Aftermarket
DS,Drive Shack Inc.,$2.81,0.26,10.20%,188910523,United States,,9137642,Consumer Services,Restaurants
DS.PRB,Drive Shack Inc.,NA,,,,,,0,,
DS.PRC,Drive Shack Inc.,NA,,,,,,0,,
DS.PRD,Drive Shack Inc.,NA,,,,,,0,,
DSAC,Duddell Street Acquisition Corp. Class A Ordinary Shares,$10.21,-0.05,-0.49%,223343750,Hong Kong,2020,42960,Finance,Business Services
DSACU,Duddell Street Acquisition Corp. Unit,$10.75,-0.05,-0.46%,0,Hong Kong,2020,11567,Finance,Business Services
DSACW,Duddell Street Acquisition Corp. Warrant,$1.61,-0.12,-6.94%,0,Hong Kong,2020,18540,Finance,Business Services
DSE,Duff & Phelps Select MLP and Midstream Energy Fund Inc.,$5.26,-0.03,-0.57%,13798842,United States,2014,30994,,
DSEP,FT Cboe Vest U.S. Equity Deep Buffer ETF - September,$31.2394,0.0092,0.03%,,United States,2020,2847,,
DSGX,Descartes Systems Group Inc. (The) Common Stock,$62.15,-0.88,-1.40%,5250679668,Canada,,64784,Technology,Computer Software: Prepackaged Software
DSKE,Daseke Inc. Common Stock,$5.77,-0.28,-4.63%,375183714,United States,2015,340956,Consumer Services,Transportation Services
DSKEW,Daseke Inc. Warrant,$0.2532,-0.0358,-12.39%,0,United States,2015,15428,Consumer Services,Transportation Services
DSL,DoubleLine Income Solutions Fund Common Shares of Beneficial Interests,$16.62,0.08,0.48%,1694523811,,2013,307427,,
DSM,BNY Mellon Strategic Municipal Bond Fund Inc. Common Stock,$7.83,0.05,0.64%,386970431,United States,1989,102530,,
DSOC,Innovator Double Stacker ETF - October,$28.4748,-0.0252,-0.09%,0,,2020,987,,
DSPG,DSP Group Inc. Common Stock,$16.71,-0.43,-2.51%,394307524,United States,1994,137057,Technology,Semiconductors
DSS,Document Security Systems Inc. Common Stock,$4.18,-0.03,-0.71%,24395366,United States,,1365452,Consumer Durables,Containers/Packaging
DSSI,Diamond S Shipping Inc. Common Stock ,$6.82,0.14,2.10%,275804844,,2019,243149,Consumer Services,Transportation Services
DSU,Blackrock Debt Strategies Fund Inc. Common Stock,$10.68,-0.03,-0.28%,499645046,United States,1998,124206,,
DSWL,Deswell Industries Inc. Common Shares,$3.2312,0.004,0.12%,51425320,Macau,1995,8256,Consumer Non-Durables,Plastic Products
DSX,Diana Shipping inc. common stock,$2.31,-0.08,-3.35%,206225255,Greece,2005,370729,Transportation,Marine Transportation
DSX.PRB,Diana Shipping inc.,NA,,,,,,0,,
DT,Dynatrace Inc. Common Stock,$43.53,-0.86,-1.94%,12279661298,United States,2019,1758221,Technology,Computer Software: Prepackaged Software
DTB,DTE Energy Company 2020 Series G 4.375% Junior Subordinated Debentures due 2080,$25.47,0.01,0.04%,0,United States,2020,40965,Public Utilities,Electric Utilities: Central
DTE,DTE Energy Company Common Stock,$122.79,-0.66,-0.54%,23767182424,United States,,976442,Public Utilities,Electric Utilities: Central
DTEA,DAVIDsTEA Inc. Common Stock,$2.77,-0.02,-0.72%,72659612,Canada,2015,160334,Consumer Non-Durables,Food Chains
DTF,DTF Tax-Free Income Inc. Common Stock,$14.40,0.03,0.21%,101225750,United States,1991,24874,,
DTIL,Precision BioSciences Inc. Common Stock,$12.40,-0.89,-6.70%,697408972,United States,2019,1906491,Health Care,Biotechnology: Biological Products (No Diagnostic Substances)
DTJ,DTE Energy Company 2016 Series B 5.375% Junior Subordinated Debentures due 2076,$25.66,-0.02,-0.08%,0,United States,2016,11567,Public Utilities,Electric Utilities: Central
