Symbol,Name,Last Sale,Net Change,% Change,Market Cap,Country,IPO Year,Volume,Sector,Industry
JOF,Japan Smaller Capitalization Fund Inc Common Stock,$8.9943,-0.0457,-0.51%,254843534,United States,1990,66898,,
JOUT,Johnson Outdoors Inc. Class A Common Stock,$111.23,-2.98,-2.61%,1123244365,United States,,16504,Consumer Non-Durables,Recreational Products/Toys
JP,Jupai Holdings Limited American Depositary Shares each representing six ordinary shares,$1.95,0.05,2.63%,65742918,,2015,25937,Consumer Services,Other Consumer Services
JPC,Nuveen Preferred & Income Opportunities Fund,$9.16,-0.04,-0.44%,946733165,United States,2003,213857,,
JPI,Nuveen Preferred and Income Term Fund Common Shares of Beneficial Interest,$24.13,0.08,0.33%,549232365,,2012,49170,,
JPM,JP Morgan Chase & Co. Common Stock,$131.58,-0.54,-0.41%,4.0124E+11,United States,,11307819,Finance,Major Banks
JPM.PRC,J P Morgan Chase & Co,NA,,,,,,0,,
JPM.PRD,J P Morgan Chase & Co,NA,,,,,,0,,
JPM.PRG,J P Morgan Chase & Co,NA,,,,,,0,,
JPM.PRH,J P Morgan Chase & Co,NA,,,,,,0,,
JPM.PRJ,J P Morgan Chase & Co,NA,,,,,,0,,
JPS,Nuveen Preferred & Income Securities Fund,$9.25,-0.09,-0.96%,1884963779,United States,2002,554678,,
JPT,Nuveen Preferred and Income 2022 Term Fund Common Shares of Beneficial Interest,$24.48,0.14,0.58%,167423126,United States,2017,2279,,
JQC,Nuveen Credit Strategies Income Fund Shares of Beneficial Interest,$6.48,0.03,0.47%,878748199,United States,2003,1087814,,
JRI,Nuveen Real Asset Income and Growth Fund Common Shares of Beneficial Interest,$13.57,0.09,0.67%,372756773,United States,2012,107616,,
JRJC,China Finance Online Co. Limited American Depositary Shares,$10.74,0.84,8.49%,26226650,China,2004,465920,Finance,Investment Bankers/Brokers/Service
JRO,Nuveen Floating Rate Income Opportuntiy Fund Shares of Beneficial Interest,$9.28,0.03,0.32%,376222503,United States,2004,248808,,
JRS,Nuveen Real Estate Income Fund Common Shares of Beneficial Interest,$8.64,0.11,1.29%,249630949,United States,2001,60414,,
JRSH,Jerash Holdings (US) Inc. Common Stock,$5.6173,-0.0327,-0.58%,63615923,United States,2018,15417,Consumer Non-Durables,Apparel
JRVR,James River Group Holdings Ltd. Common Shares,$47.51,-0.48,-1.00%,1454288369,Bermuda,2014,161118,Finance,Property-Casualty Insurers
JSD,Nuveen Short Duration Credit Opportunities Fund Common Shares of Beneficial Interest,$13.62,0,0.00%,137366526,United States,2011,17421,,
JSM,Navient Corporation 6% Senior Notes due December 15 2043,$24.62,-0.16,-0.65%,0,United States,,10200,Finance,Finance: Consumer Services
JT,Jianpu Technology Inc. American depositary shares,$3.44,-0.07,-1.99%,72701603,,2017,221143,Technology,Computer Software: Programming Data Processing
JTA,Nuveen Tax-Advantaged Total Return Strategy Fund Common Share of Beneficial Interest,$9.75,0,0.00%,135046246,United States,2004,23393,,
JTD,Nuveen Tax-Advantaged Dividend Growth Fund Common Shares of Beneficial Interest,$14.35,0.08,0.56%,207850279,United States,,37915,,
JULZ,TrueShares Structured Outcome (July) ETF,$29.7372,0.047,0.16%,,United States,2020,700,,
JUPW,Jupiter Wellness Inc. Common Stock,$5.83,0.24,4.29%,53533001,United States,2020,262971,Consumer Non-Durables,Package Goods/Cosmetics
JUPWW,Jupiter Wellness Inc. Warrant,$0.9399,0.0599,6.81%,0,United States,2020,26504,Consumer Non-Durables,Package Goods/Cosmetics
JVA,Coffee Holding Co. Inc. Common Stock,$5.36,0.24,4.69%,30598091,United States,2005,69897,Consumer Non-Durables,Food Distributors
JW/A,John Wiley & Sons Inc.,$46.50,-0.18,-0.39%,,United States,,222097,,
JW/B,John Wiley & Sons Inc.,$49.43,0,0.00%,,United States,,2,,
JWN,Nordstrom Inc. Common Stock,$39.49,1.5,3.95%,6226922126,United States,,4201880,Consumer Services,Clothing/Shoe/Accessory Stores
JWS,Jaws Acquisition Corp. Class A Ordinary Shares,$13.65,-0.16,-1.16%,1177312500,,2020,699467,Finance,Business Services
JWS.U,Jaws Acquisition Corp. Units each consisting of one Class A ordinary share and one-third of one redeemable warrant,NA,,,,,2020,0,,
JWS.WS,Jaws Acquisition Corp. Redeemable Warrants each whole warrant exercisable for one Class A ordinary share at an exercise price of $11.50,NA,,,,,,0,,
JYAC,Jiya Acquisition Corp. Class A Common Stock,$10.28,-0.06,-0.58%,141113971,United States,2020,15363,Finance,Business Services
JYNT,The Joint Corp. Common Stock,$31.05,1.12,3.74%,435977583,United States,2014,126813,Miscellaneous,Multi-Sector Companies
K,Kellogg Company Common Stock,$60.92,1.08,1.81%,20938994498,United States,,2949156,Consumer Non-Durables,Packaged Foods
KAI,Kadant Inc Common Stock,$144.19,-2.46,-1.68%,1659563456,United States,,23147,Technology,Industrial Machinery/Components
KAIRU,Kairos Acquisition Corp. Unit,$10.41,-0.04,-0.38%,0,United States,2021,372843,Finance,Business Services
KALA,Kala Pharmaceuticals Inc. Common Stock,$7.20,0.1,1.41%,403631028,United States,2017,2004980,Health Care,Major Pharmaceuticals
KALU,Kaiser Aluminum Corporation Common Stock,$95.31,-2.46,-2.52%,1507057827,United States,,65624,Capital Goods,Metal Fabrications
KALV,KalVista Pharmaceuticals Inc. Common Stock,$16.35,-0.09,-0.55%,293354414,United Kingdom,2015,106027,Health Care,Major Pharmaceuticals
KAMN,Kaman Corporation Common Stock,$55.59,-0.94,-1.66%,1538586277,United States,,132902,Capital Goods,Military/Government/Technical
KAR,KAR Auction Services Inc Common Stock,$18.84,0.56,3.06%,2435099240,United States,2009,1399003,Consumer Durables,Automotive Aftermarket
KB,KB Financial Group Inc,$39.04,-0.87,-2.18%,15406524438,South Korea,,231938,Finance,Commercial Banks
KBAL,Kimball International Inc. Class B Common Stock,$12.48,-0.07,-0.56%,461478588,United States,,169390,Consumer Durables,Home Furnishings
KBH,KB Home Common Stock,$42.02,-0.65,-1.52%,4149982938,United States,1986,2346931,Capital Goods,Homebuilding
KBNT,Kubient Inc. Common Stock,$6.03,-0.25,-3.98%,70889337,United States,2020,656991,Technology,EDP Services
KBNTW,Kubient Inc. Warrant,$2.1899,-0.1601,-6.81%,0,United States,2020,33037,Technology,EDP Services
KBR,KBR Inc. Common Stock,$29.99,-0.21,-0.70%,4274386319,United States,2006,775662,Basic Industries,Military/Government/Technical
KBSF,KBS Fashion Group Limited Common Stock,$3.31,0,0.00%,8577200,China,2013,94620,Consumer Non-Durables,Apparel
KC,Kingsoft Cloud Holdings Limited American Depositary Shares,$52.74,-1.06,-1.97%,11498256979,China,2020,1836322,Technology,Computer Software: Prepackaged Software
KCAPL,KCAP Financial Inc. 6.125% Notes due 2022,$25.2028,0.0528,0.21%,0,United States,,1812,,
KDMN,Kadmon Holdings Inc. Common Stock,$5.27,0.11,2.13%,903873220,United States,,4804431,Health Care,Major Pharmaceuticals
KDNY,Chinook Therapeutics Inc. Common Stock,$15.31,-0.79,-4.91%,645445594,United States,2015,107568,Health Care,Major Pharmaceuticals
KDP,Keurig Dr Pepper Inc. Common Stock,$32.63,0.6,1.87%,45918674983,United States,,7078400,Consumer Non-Durables,Beverages (Production/Distribution)
KE,Kimball Electronics Inc. Common Stock,$21.31,1.01,4.98%,535803489,United States,,322451,Technology,Electrical Products
KELYA,Kelly Services Inc. Class A Common Stock,$20.75,-0.55,-2.58%,815407770,United States,,48535,Technology,Professional Services
KELYB,Kelly Services Inc. Class B Common Stock,$20.82,-0.18,-0.86%,818158543,United States,,785,Technology,Professional Services
KEN,Kenon Holdings Ltd. Ordinary Shares,$31.31,0.21,0.68%,1686705988,Singapore,2015,2361,Public Utilities,Electric Utilities: Central
KEP,Korea Electric Power Corporation Common Stock,$11.13,0.06,0.54%,14290120354,South Korea,1994,104633,Public Utilities,Electric Utilities: Central
KEQU,Kewaunee Scientific Corporation Common Stock,$12.93,-0.02,-0.15%,35722965,United States,,511,Capital Goods,Medical Specialities
KERN,Akerna Corp. Common Stock,$5.61,0.25,4.66%,78869346,United States,2018,2680279,Technology,EDP Services
KERNW,Akerna Corp Warrant,$1.39,0.09,6.92%,0,United States,2018,54308,Technology,EDP Services
KEX,Kirby Corporation Common Stock,$51.00,-0.88,-1.70%,3061989000,United States,,348052,Consumer Services,Marine Transportation
KEY,KeyCorp Common Stock,$17.46,-0.32,-1.80%,17036996580,United States,,8245068,Finance,Major Banks
KEY.PRI,KeyCorp,NA,,,,,,0,,
KEY.PRJ,KeyCorp,NA,,,,,,0,,
KEY.PRK,KeyCorp,NA,,,,,,0,,
KEYS,Keysight Technologies Inc. Common Stock,$146.88,0.83,0.57%,27333494945,United States,2014,1432663,Capital Goods,Industrial Machinery/Components
KF,Korea Fund Inc. (The) New Common Stock,$44.563,-0.337,-0.75%,224206212,United States,,5741,,
KFFB,Kentucky First Federal Bancorp Common Stock,$6.45,0,0.00%,53126812,United States,,2419,Finance,Savings Institutions
KFRC,Kforce Inc. Common Stock,$44.485,0.025,0.06%,976716130,United States,1995,123874,Technology,Professional Services
KFS,Kingsway Financial Services Inc. Common Stock (DE),$4.75,0.05,1.06%,107877578,Canada,,17504,Finance,Property-Casualty Insurers
KFY,Korn Ferry Common Stock,$48.14,-0.45,-0.93%,2596571084,United States,1999,236873,Technology,Diversified Commercial Services
KGC,Kinross Gold Corporation Common Stock,$7.05,0.01,0.14%,8871015000,Canada,,15754879,Basic Industries,Precious Metals
KHC,The Kraft Heinz Company Common Stock,$34.39,0.64,1.90%,42046010748,United States,,4664540,Consumer Non-Durables,Packaged Foods
KIDS,OrthoPediatrics Corp. Common Stock,$48.59,2.95,6.46%,950159034,United States,2017,266000,Health Care,Medical/Dental Instruments
KIM,Kimco Realty Corporation Common Stock,$17.27,0.23,1.35%,7469251893,United States,,4725108,Consumer Services,Real Estate Investment Trusts
KIM.PRL,Kimco Realty Corporation,NA,,,,,,0,,
KIM.PRM,Kimco Realty Corporation,NA,,,,,,0,,
KIN,Kindred Biosciences Inc. Common Stock,$4.79,-0.07,-1.44%,189167322,United States,2013,268370,Health Care,Major Pharmaceuticals
KINS,Kingstone Companies Inc. Common Stock,$7.12,-0.02,-0.28%,76007410,United States,,8203,Finance,Property-Casualty Insurers
KINZU,KINS Technology Group Inc. Unit,$10.73,0.03,0.28%,0,United States,2020,174713,Finance,Business Services
KIO,KKR Income Opportunities Fund Common Shares,$14.84,0.14,0.95%,301850275,,2013,74155,,
KIQ,Kelso Technologies Inc Ordinary Shares,$0.783,-0.1359,-14.79%,36934177,Canada,,2502710,Capital Goods,Railroads
KIRK,Kirkland's Inc. COMMONSTOCK,$27.09,0.9,3.44%,386184096,United States,2002,774664,Consumer Services,Other Specialty Stores
KJUL,Innovator Russell 2000 Power Buffer ETF - July,$26.0249,-0.166,-0.63%,,,2020,1885,,
KKR,KKR & Co. Inc. Common Stock,$39.15,-0.4,-1.01%,22283753108,United States,,2703584,Finance,Investment Managers
KKR.PRA,KKR & Co. Inc.,NA,,,,,,0,,
KKR.PRB,KKR & Co. Inc.,NA,,,,,,0,,
KKR.PRC,KKR & Co. Inc.,NA,,,,,,0,,
KL,Kirkland Lake Gold Ltd. Common Shares,$39.91,0.26,0.66%,10656918940,,,1030171,Basic Industries,Precious Metals
KLAC,KLA Corporation Common Stock,$303.55,-5.35,-1.73%,46886277450,United States,1980,832412,Capital Goods,Electronic Components
KLAQU,KL Acquisition Corp Unit,$10.49,0.04,0.38%,0,United States,2021,551534,Finance,Business Services
KLDO,Kaleido Biosciences Inc. Common Stock,$12.62,0.18,1.45%,454094165,United States,2019,84696,Health Care,Biotechnology: Biological Products (No Diagnostic Substances)
KLIC,Kulicke and Soffa Industries Inc. Common Stock,$36.66,-1.46,-3.83%,2274366164,Singapore,,404310,Technology,Semiconductors
KLR,Kaleyra Inc. Common Stock,$13.40,-0.4,-2.90%,392962785,United States,2018,295964,Technology,EDP Services
KLR.WS,Kaleyra Inc. Warrants,NA,,,,United States,,0,,
KLXE,KLX Energy Services Holdings Inc. Common Stock,$7.59,0.17,2.29%,64591796,United States,,241636,Energy,Oilfield Services/Equipment
KMB,Kimberly-Clark Corporation Common Stock,$137.13,0.62,0.45%,46642947728,United States,,3134949,Consumer Durables,Containers/Packaging
KMDA,Kamada Ltd. Ordinary Shares,$6.73,-0.08,-1.18%,301120141,Israel,2013,74214,Health Care,Major Pharmaceuticals
KMF,Kayne Anderson NextGen Energy & Infrastructure Inc.,$6.26,-0.03,-0.48%,295456112,,2010,171464,,
KMI,Kinder Morgan Inc. Common Stock,$15.22,-0.04,-0.26%,34451013126,United States,2011,16015984,Public Utilities,Natural Gas Distribution
KMPH,KemPharm Inc. Common Stock,$6.46,-1.07,-14.21%,75264065,United States,,13237966,Health Care,Major Pharmaceuticals
KMPR,Kemper Corporation,$74.10,-0.87,-1.16%,4846763626,United States,,169084,Finance,Property-Casualty Insurers
KMT,Kennametal Inc. Common Stock,$40.79,0.66,1.65%,3396829345,United States,,1122884,Capital Goods,Industrial Machinery/Components
KMX,CarMax Inc,$127.79,6.83,5.65%,20771172023,United States,,2606107,Consumer Durables,Automotive Aftermarket
KN,Knowles Corporation Common Stock,$19.66,-0.43,-2.14%,1802306456,,2014,689108,Consumer Non-Durables,Consumer Electronics/Appliances
KNDI,Kandi Technologies Group Inc Common Stock,$8.82,0.48,5.76%,638370035,China,,13908755,Capital Goods,Auto Manufacturing
KNGS,UPHOLDINGS Compound Kings ETF,$27.4166,-0.1044,-0.38%,,United States,2020,824,,
KNL,Knoll Inc. Common Stock,$16.29,0.18,1.12%,825610643,United States,2004,165097,Consumer Durables,Office Equipment/Supplies/Services
KNOP,KNOT Offshore Partners LP Common Units representing Limited Partner Interests,$17.32,0,0.00%,566261708,United Kingdom,2013,107504,Consumer Services,Marine Transportation
KNSA,Kiniksa Pharmaceuticals Ltd. Class A Common Stock,$19.72,-0.05,-0.25%,1342439690,United States,2018,422836,Health Care,Major Pharmaceuticals
KNSL,Kinsale Capital Group Inc. Common Stock,$189.44,-3.98,-2.06%,4295946604,United States,2016,160349,Finance,Property-Casualty Insurers
KNTE,Kinnate Biopharma Inc. Common Stock,$36.41,-1.09,-2.91%,1577544044,United States,2020,62239,Health Care,Major Pharmaceuticals
KNX,Knight-Swift Transportation Holdings Inc.,$44.50,-0.56,-1.24%,7557503397,United States,2017,1813860,Transportation,Trucking Freight/Courier Services
KO,Coca-Cola Company (The) Common Stock,$49.29,0.51,1.05%,2.11821E+11,United States,,12922626,Consumer Non-Durables,Beverages (Production/Distribution)
KOD,Kodiak Sciences Inc Common Stock,$145.91,-9.98,-6.40%,7408677864,United States,2018,284930,Health Care,Biotechnology: Biological Products (No Diagnostic Substances)
KODK,Eastman Kodak Company Common New,$9.43,-0.12,-1.26%,727650164,United States,,7539967,Miscellaneous,Industrial Machinery/Components
KOF,Coca Cola Femsa S.A.B. de C.V.  American Depositary Shares each representing 10 Units (each Unit consists of 3 Series B Shares and 5 Series L Shares),$46.50,0.65,1.42%,9768870009,Mexico,1993,93518,Consumer Non-Durables,Beverages (Production/Distribution)
KOP,Koppers Holdings Inc. Koppers Holdings Inc. Common Stock,$34.66,-0.1,-0.29%,730127353,United States,2006,120250,Basic Industries,Forest Products
KOPN,Kopin Corporation Common Stock,$5.26,0.01,0.19%,447378990,United States,1992,5521183,Technology,Semiconductors
KOR,Corvus Gold Inc. Common Shares,$2.21,-0.07,-3.07%,279858587,Canada,,129860,Basic Industries,Precious Metals
KOS,Kosmos Energy Ltd. Common Shares (DE),$2.44,-0.15,-5.79%,989310317,Bermuda,2011,7200393,Energy,Oil & Gas Production
KOSS,Koss Corporation Common Stock,$10.00,4,66.67%,74048310,United States,,34562731,Consumer Non-Durables,Consumer Electronics/Appliances
KPTI,Karyopharm Therapeutics Inc. Common Stock,$15.74,0.03,0.19%,1158476230,United States,2013,2561896,Health Care,Major Pharmaceuticals
KR,Kroger Company (The) Common Stock,$37.07,2.5,7.23%,28223135514,United States,,24964993,Consumer Services,Food Chains
KRA,Kraton Corporation Common Stock,$29.40,-1.62,-5.22%,937033713,United States,2009,162251,Basic Industries,Major Chemicals
KRBP,Kiromic BioPharma Inc. Common Stock,$9.08,0.26,2.95%,66583631,United States,2020,34491,Health Care,Biotechnology: Biological Products (No Diagnostic Substances)
KRC,Kilroy Realty Corporation Common Stock,$58.37,0.4,0.69%,6727208808,United States,1997,1249885,Consumer Services,Real Estate Investment Trusts
KREF,KKR Real Estate Finance Trust Inc. Common Stock,$17.49,-0.39,-2.18%,972783796,United States,2017,155798,Consumer Services,Real Estate Investment Trusts
KRG,Kite Realty Group Trust Common Stock,$17.29,0.18,1.05%,1455879691,United States,2004,241433,Consumer Services,Real Estate Investment Trusts
KRKR,36Kr Holdings Inc. American Depositary Shares,$4.20,-0.78,-15.66%,157476228,China,2019,658148,Miscellaneous,Business Services
KRMD,Repro Med Systems Inc. Common Stock,$4.33,-0.8,-15.60%,190272705,United States,,2919388,Health Care,Medical/Dental Instruments
KRNT,Kornit Digital Ltd. Ordinary Shares,$96.46,-0.44,-0.45%,4367508935,Israel,2015,98768,Capital Goods,Industrial Machinery/Components
KRNY,Kearny Financial Corp Common Stock,$10.55,-0.36,-3.30%,944335258,United States,,227681,Finance,Savings Institutions
KRO,Kronos Worldwide Inc Common Stock,$14.95,-0.1,-0.66%,1727363619,United States,,87737,Basic Industries,Major Chemicals
KRON,Kronos Bio Inc. Common Stock,$28.93,-2.77,-8.74%,1621049271,United States,2020,73983,Health Care,Major Pharmaceuticals
KROS,Keros Therapeutics Inc. Common Stock,$66.57,-2.85,-4.11%,1542982826,United States,2020,125248,Health Care,Major Pharmaceuticals
KRP,Kimbell Royalty Partners Common Units Representing Limited Partner Interests,$8.88,0.06,0.68%,533529563,United States,2017,193725,Energy,Oil & Gas Production
KRTX,Karuna Therapeutics Inc. Common Stock,$99.42,-3.38,-3.29%,2665108792,United States,2019,207828,Health Care,Major Pharmaceuticals
KRUS,Kura Sushi USA Inc. Class A Common Stock,$24.96,1.11,4.65%,208957283,United States,2019,94277,Consumer Services,Restaurants
KRYS,Krystal Biotech Inc. Common Stock,$71.17,-1.83,-2.51%,1402591315,United States,2017,80408,Health Care,Biotechnology: Biological Products (No Diagnostic Substances)
KSM,DWS Strategic Municipal Income Trust,$11.78,0.05,0.43%,131982425,United States,1989,31050,,
KSMT,Kismet Acquisition One Corp Ordinary Shares,$10.90,0.55,5.31%,346075000,Russia,2020,106913,Finance,Business Services
KSMTU,Kismet Acquisition One Corp Unit,$11.70,0.2,1.74%,0,Russia,2020,37704,Finance,Business Services
KSMTW,Kismet Acquisition One Corp Warrant,$1.48,0.27,22.31%,0,Russia,,482977,Finance,Business Services
KSPN,Kaspien Holdings Inc. Common Stock,$30.47,-5.43,-15.13%,58051383,United States,,48473,Consumer Services,Consumer Electronics/Video Chains
KSS,Kohl's Corporation Common Stock,$45.16,0.23,0.51%,7119582158,United States,1992,3371969,Consumer Services,Department/Specialty Retail Stores
KSU,Kansas City Southern Common Stock,$211.45,-6.7,-3.07%,19792047536,United States,,998325,Transportation,Railroads
KSU.PR,Kansas City Southern,NA,,,,,,0,,
KT,KT Corporation Common Stock,$11.00,-0.08,-0.72%,5324926860,South Korea,,862704,Public Utilities,Telecommunications Equipment
KTB,Kontoor Brands Inc. Common Stock ,$40.47,0.2,0.50%,2315101324,,2019,436175,Consumer Non-Durables,Apparel
KTCC,Key Tronic Corporation Common Stock,$7.75,-0.14,-1.77%,83387520,United States,1983,182028,Technology,Electrical Products
KTF,DWS Municipal Income Trust,$11.57,0.01,0.09%,457025853,United States,1988,52481,,
KTH,Structures Products Cp 8% CorTS Issued by Peco Energy Cap Tr II Preferred Stock,$33.25,-0.0101,-0.03%,0,United States,,1225,Finance,Finance: Consumer Services
KTN,Structured Products Corp 8.205% CorTS 8.205% Corporate Backed Trust Securities (CorTS),$33.29,0.56,1.71%,0,United States,,935,Finance,Finance: Consumer Services
KTOS,Kratos Defense & Security Solutions Inc. Common Stock,$29.16,-0.81,-2.70%,3579568692,United States,,745551,Capital Goods,Military/Government/Technical
KTRA,Kintara Therapeutics Inc. Common Stock,$2.13,0.08,3.90%,52530697,United States,,2289387,Health Care,Major Pharmaceuticals
KUKE,Kuke Music Holding Limited American Depositary Shares each representing one Ordinary Share,$9.02,-0.11,-1.21%,266691841,,2021,95719,Consumer Services,Other Consumer Services
KURA,Kura Oncology Inc. Common Stock,$32.80,-1.73,-5.01%,2165934519,United States,,475378,Health Care,Major Pharmaceuticals
KVHI,KVH Industries Inc. Common Stock,$13.36,-0.02,-0.15%,244523524,United States,1996,81597,Technology,Radio And Television Broadcasting And Communications Equipment
KW,Kennedy-Wilson Holdings Inc. Common Stock,$17.44,-0.21,-1.19%,2471764189,United States,,185677,Finance,Real Estate
KWAC.U,Kingswood Acquisition Corp. Units each consisting of one share of Class A Common Stock and three-fourths of one redeemable warrant,NA,,,,,2020,0,,
KWR,Quaker Chemical Corporation Common Stock,$269.30,-2.31,-0.85%,4802043417,United States,,74422,Basic Industries,Major Chemicals
KXIN,Kaixin Auto Holdings Ordinary Share,$3.99,-0.04,-0.99%,259877275,China,2017,3517928,Consumer Durables,Automotive Aftermarket
KYMR,Kymera Therapeutics Inc. Common Stock,$71.00,-7.42,-9.46%,3156584811,United States,2020,158791,Health Care,Biotechnology: Biological Products (No Diagnostic Substances)
KYN,Kayne Anderson Energy Infrastructure Fund Inc.,$6.50,-0.08,-1.22%,821909101,United States,2004,581177,,
KZIA,Kazia Therapeutics Limited American Depositary Shares,$10.20,0.12,1.19%,96515827,Australia,,98854,Health Care,Major Pharmaceuticals
KZR,Kezar Life Sciences Inc. Common Stock,$5.50,-0.23,-4.01%,255200000,United States,2018,163829,Health Care,Major Pharmaceuticals
L,Loews Corporation Common Stock,$46.22,-0.51,-1.09%,12704624144,United States,,513531,Finance,Property-Casualty Insurers
LAC,Lithium Americas Corp. Common Shares,$22.38,-0.67,-2.91%,2671582399,Canada,,8018944,Basic Industries,Precious Metals
LACQ,Leisure Acquisition Corp. Common Stock,$12.6464,0.3464,2.82%,79195336,United States,2017,2397,Finance,Business Services
LACQU,Leisure Acquisition Corp. Unit,$16.00,3,23.08%,0,United States,2017,5558,Finance,Business Services
LACQW,Leisure Acquisition Corp. Warrant,$1.0373,0.0213,2.10%,0,United States,2017,34359,Finance,Business Services
LAD,Lithia Motors Inc. Common Stock,$342.72,3.56,1.05%,9090405012,United States,,344505,Consumer Durables,Automotive Aftermarket
LADR,Ladder Capital Corp Class A Common Stock,$10.56,-0.01,-0.10%,1312264346,,2014,1345523,Consumer Services,Real Estate Investment Trusts
LAIX,LAIX Inc. American Depositary Shares each  representing one Class A Ordinary Share,$2.05,-0.12,-5.53%,101295078,,2018,708659,Consumer Services,Other Consumer Services
LAKE,Lakeland Industries Inc. Common Stock,$27.14,0.17,0.63%,217662257,United States,1986,188103,Health Care,Industrial Specialties
LAMR,Lamar Advertising Company Class A Common Stock,$81.88,-1.98,-2.36%,8257438498,United States,1996,415306,Consumer Services,Real Estate Investment Trusts
LANC,Lancaster Colony Corporation Common Stock,$179.27,1.44,0.81%,4936916530,United States,,119552,Consumer Non-Durables,Packaged Foods
LAND,Gladstone Land Corporation Common Stock,$16.57,-0.36,-2.13%,399376867,United States,2013,414186,Consumer Services,Real Estate Investment Trusts
LANDM,Gladstone Land Corporation 5.00% Series D Cumulative Term Preferred Stock,$25.90,-0.09,-0.35%,624252315,United States,,10355,Consumer Services,Real Estate Investment Trusts
LANDO,Gladstone Land Corporation 6.00% Series B Cumulative Redeemable Preferred Stock,$25.34,-0.155,-0.61%,0,United States,,55303,Consumer Services,Real Estate Investment Trusts
LANDP,Gladstone Land Corporation 6.375% Series A Cumulative Term Preferred Stock,$25.07,0.03,0.12%,0,United States,,4777,Consumer Services,Real Estate Investment Trusts
LARK,Landmark Bancorp Inc. Common Stock,$23.50,-0.51,-2.12%,111308620,United States,,8272,Finance,Major Banks
LASR,nLIGHT Inc. Common Stock,$34.76,-0.56,-1.59%,1368361847,United States,2018,216727,Technology,Semiconductors
LATN,Union Acquisition Corp. II Ordinary Shares,$10.25,-0.13,-1.25%,256250000,United States,2019,70309,Finance,Business Services
LATNU,Union Acquisition Corp. II Units containing one ordinary share and one redeemable warrant,$11.41,0,0.00%,0,United States,2019,12,Finance,Business Services
LATNW,Union Acquisition Corp. II Warrant,$1.05,-0.035,-3.23%,0,United States,2019,87745,Finance,Business Services
LAUR,Laureate Education Inc. Class A Common Stock,$13.74,0.31,2.31%,2886396466,United States,2017,1024149,Consumer Services,Other Consumer Services
LAWS,Lawson Products Inc. Common Stock,$54.44,2.29,4.39%,491611002,United States,,34194,Consumer Durables,Industrial Specialties
LAZ,Lazard LTD. Lazard LTD. Class A Common Stock,$42.35,-0.37,-0.87%,4448103633,Bermuda,2005,840688,Finance,Investment Managers
LAZR,Luminar Technologies Inc.  Class A Common Stock,$36.32,-1.13,-3.02%,11765364237,United States,2019,8059774,Capital Goods,Auto Parts:O.E.M.
LAZRW,Luminar Technologies Inc. Warrant,$23.33,-1.26,-5.12%,0,United States,2019,245273,Capital Goods,Auto Parts:O.E.M.
LAZY,Lazydays Holdings Inc. Common Stock,$19.83,-0.36,-1.78%,187430205,United States,,119830,Consumer Durables,Automotive Aftermarket
LB,L Brands Inc.,$43.00,-0.93,-2.12%,11958668209,United States,,5143686,Consumer Services,Clothing/Shoe/Accessory Stores
LBAI,Lakeland Bancorp Inc. Common Stock,$13.37,-0.34,-2.48%,674768324,United States,,155709,Finance,Major Banks
LBC,Luther Burbank Corporation Common Stock,$10.07,-0.13,-1.28%,527768297,United States,2017,36643,Finance,Major Banks
LBRDA,Liberty Broadband Corporation Class A Common Stock,$153.62,-1.04,-0.67%,36852396917,United States,,216478,Consumer Services,Television Services
LBRDK,Liberty Broadband Corporation Class C Common Stock,$154.27,-1.25,-0.80%,37008327512,United States,,1879473,Consumer Services,Television Services
LBRDP,Liberty Broadband Corporation Series A Cumulative Redeemable Preferred Stock,$28.30,-0.1,-0.35%,0,United States,,2647,Public Utilities,Telecommunications Equipment
LBRT,Liberty Oilfield Services Inc. Class A Common Stock,$11.77,-0.32,-2.65%,2109888093,United States,2018,500379,Energy,Oilfield Services/Equipment
LBTYA,Liberty Global plc Class A Ordinary Shares,$25.80,0.37,1.46%,15044138851,United Kingdom,,1785965,,
LBTYB,Liberty Global plc Class B Ordinary Shares,$26.55,0.05,0.19%,15481468468,United Kingdom,,1153,Consumer Services,Television Services
LBTYK,Liberty Global plc Class C Ordinary Shares,$25.45,0.34,1.35%,14840051696,United Kingdom,,3147365,,
