Symbol,Name,Last Sale,Net Change,% Change,Market Cap,Country,IPO Year,Volume,Sector,Industry
POR,Portland General Electric Co Common Stock,$42.20,-0.07,-0.17%,3777347573,United States,,510493,Public Utilities,Electric Utilities: Central
POSH,Poshmark Inc. Class A Common Stock,$73.25,-1.01,-1.36%,5358086385,United States,2021,326172,Consumer Services,Catalog/Specialty Distribution
POST,Post Holdings Inc. Common Stock,$100.33,-0.14,-0.14%,6609749731,United States,2012,323839,Consumer Non-Durables,Packaged Foods
POWI,Power Integrations Inc. Common Stock,$90.50,-2.44,-2.63%,5417415523,United States,1997,372891,Technology,Semiconductors
POWL,Powell Industries Inc. Common Stock,$29.65,-0.9,-2.95%,346159984,United States,,44846,Consumer Durables,Electrical Products
POWRU,Powered Brands Units,$10.61,0.11,1.05%,0,United States,2021,834434,Finance,Business Services
POWW,AMMO Inc. Common Stock,$5.81,-0.02,-0.34%,356973599,United States,,1849681,Capital Goods,Ordnance And Accessories
PPBI,Pacific Premier Bancorp Inc,$35.55,0.19,0.54%,3355410284,United States,,423597,Finance,Major Banks
PPBT,Purple Biotech Ltd. American Depositary Shares,$4.47,-0.07,-1.54%,76931266,Israel,2015,559059,Health Care,Major Pharmaceuticals
PPC,Pilgrim's Pride Corporation Common Stock,$20.49,0,0.00%,4990401749,United States,,629792,Consumer Non-Durables,Meat/Poultry/Fish
PPD,PPD Inc. Common Stock,$34.75,-0.15,-0.43%,12150492103,United States,2020,639759,Health Care,Biotechnology: Commercial Physical & Biological Resarch
PPG,PPG Industries Inc. Common Stock,$141.01,0.41,0.29%,33307184841,United States,,1447284,Basic Industries,Paints/Coatings
PPGHU,Poema Global Holdings Corp. Unit,$10.62,0.02,0.19%,0,China,2021,146149,Finance,Business Services
PPIH,Perma-Pipe International Holdings Inc. Common Stock,$6.21,-0.04,-0.64%,50704582,United States,,27903,Capital Goods,Pollution Control Equipment
PPL,PPL Corporation Common Stock,$28.25,0.14,0.50%,21719371818,United States,,3469806,Public Utilities,Electric Utilities: Central
PPR,Voya Prime Rate Trust Shares of Beneficial Interest,$4.54,0,0.00%,555092761,United States,,257840,,
PPSI,Pioneer Power Solutions Inc. Common Stock,$9.09,-0.51,-5.31%,79319749,United States,,1427827,Consumer Durables,Electrical Products
PPT,Putnam Premier Income Trust Common Stock,$4.69,0.01,0.21%,480808796,United States,1988,329612,,
PPX,PPL Capital Funding Inc. 2013 Series B Junior Subordinated Notes due 2073,$26.19,0.12,0.46%,0,,,7081,Public Utilities,Electric Utilities: Central
PQG,PQ Group Holdings Inc. Common Stock,$14.64,-0.17,-1.15%,1995988950,United States,2017,81571,Basic Industries,Major Chemicals
PRA,ProAssurance Corporation Common Stock,$18.91,-0.63,-3.22%,1019055456,United States,,153291,Finance,Property-Casualty Insurers
PRAA,PRA Group Inc. Common Stock,$33.98,-0.02,-0.06%,1548807822,United States,2002,175707,Finance,Finance: Consumer Services
PRAH,PRA Health Sciences Inc. Common Stock,$128.17,-3.21,-2.44%,8222057564,United States,2014,290748,Health Care,Biotechnology: Commercial Physical & Biological Resarch
PRAX,Praxis Precision Medicines Inc. Common Stock,$53.83,-3.01,-5.30%,2059637700,United States,2020,164948,Health Care,Major Pharmaceuticals
PRCH,Porch Group Inc. Common Stock,$16.36,-0.23,-1.39%,1332956996,United States,2020,1106573,Technology,Computer Software: Prepackaged Software
PRCHW,Porch Group Inc. Warrant,$4.98,0.18,3.75%,0,United States,2020,459526,Technology,Computer Software: Prepackaged Software
PRDO,Perdoceo Education Corporation Common Stock,$12.36,-0.22,-1.75%,856386813,United States,,276831,Consumer Services,Other Consumer Services
PRE.PRG,PartnerRe Ltd.,NA,,,,,,0,,
PRE.PRH,PartnerRe Ltd.,NA,,,,,,0,,
PRE.PRI,PartnerRe Ltd.,NA,,,,,,0,,
PRFT,Perficient Inc. Common Stock,$54.75,0.54,1.00%,1807206068,United States,1999,249122,Technology,EDP Services
PRFX,PainReform Ltd. Ordinary Shares,$4.91,0.44,9.84%,43001859,Israel,2020,106719,Health Care,Major Pharmaceuticals
PRG,PROG Holdings Inc. Common Stock,$49.47,-0.13,-0.26%,3342045680,United States,,504621,Technology,Diversified Commercial Services
PRGO,Perrigo Company plc Ordinary Shares,$44.49,-0.01,-0.02%,6072498248,United States,,939959,Health Care,Major Pharmaceuticals
PRGS,Progress Software Corporation Common Stock (DE),$43.07,0.26,0.61%,1942529013,United States,1991,312161,Technology,Computer Software: Prepackaged Software
PRGX,PRGX Global Inc. Common Stock,$7.63,0,0.00%,180360801,United States,1996,178848,Consumer Services,Diversified Commercial Services
PRI,Primerica Inc. Common Stock,$134.89,1.51,1.13%,5301618090,United States,2010,122586,Finance,Life Insurance
PRIF.PRA,Priority Income Fund Inc.,NA,,,,,,0,,
PRIF.PRB,Priority Income Fund Inc.,NA,,,,,,0,,
PRIF.PRC,Priority Income Fund Inc.,NA,,,,,,0,,
PRIF.PRD,Priority Income Fund Inc.,NA,,,,,,0,,
PRIF.PRE,Priority Income Fund Inc.,NA,,,,,,0,,
PRIF.PRF,Priority Income Fund Inc.,NA,,,,,,0,,
PRIM,Primoris Services Corporation Common Stock,$30.29,-0.4,-1.30%,1456837472,United States,,218084,Basic Industries,Water Supply
PRK,Park National Corporation Common Stock,$113.88,1.62,1.44%,1857861665,United States,,74173,Finance,Major Banks
PRLB,Proto Labs Inc. Common stock,$224.00,16.13,7.76%,5998002304,United States,2012,818638,Capital Goods,Metal Fabrications
PRLD,Prelude Therapeutics Incorporated Common Stock,$69.93,-5.06,-6.75%,3257226183,United States,2020,533481,Health Care,Major Pharmaceuticals
PRMW,Primo Water Corporation Common Stock,$16.06,0.22,1.39%,2572764719,Canada,,862816,Consumer Non-Durables,Beverages (Production/Distribution)
PRO,PROS Holdings Inc. Common Stock,$43.38,-0.48,-1.09%,1884209649,United States,2007,182428,Technology,EDP Services
PROF,Profound Medical Corp. Common Stock,$27.30,0.61,2.29%,535788544,Canada,,113891,Health Care,Medical/Dental Instruments
PROG,Progenity Inc. Common Stock,$7.27,0.89,13.95%,397275904,United States,1995,1769515,Health Care,Medical Specialities
PROS,ProSight Global Inc. Common Stock,$12.61,0.01,0.08%,550516018,United States,2019,39313,Finance,Property-Casualty Insurers
PROV,Provident Financial Holdings Inc. Common Stock,$17.02,-0.11,-0.64%,126667163,United States,,21855,Finance,Savings Institutions
PRPB,CC Neuberger Principal Holdings II Class A Ordinary Shares,$10.70,-0.05,-0.47%,1160950000,United States,2020,517861,Finance,Business Services
PRPB.U,CC Neuberger Principal Holdings II Units each consisting of one Class A ordinary share and one-fourth of one redeemable warrant,NA,,,,United States,2020,0,,
PRPB.WS,CC Neuberger Principal Holdings II Redeemable warrants each whole warrant exercisable for one Class A ordinary share at an exercise price of $11.50,NA,,,,United States,,0,,
PRPH,ProPhase Labs Inc. Common Stock (DE),$11.31,-0.7,-5.83%,171394601,United States,,355382,Health Care,Major Pharmaceuticals
PRPL,Purple Innovation Inc. Common Stock,$37.47,-1.68,-4.29%,2414754150,United States,2015,896963,Consumer Durables,Home Furnishings
PRPO,Precipio Inc.  Common Stock,$2.96,-0.14,-4.52%,50991671,United States,,1228016,Capital Goods,Biotechnology: Laboratory Analytical Instruments
PRQR,ProQR Therapeutics N.V. Ordinary Shares,$5.59,-0.2,-3.45%,280317280,Netherlands,2014,2299260,Health Care,Major Pharmaceuticals
PRS,Prudential Financial Inc. 5.625% Junior Subordinated Notes due 2058,$27.90,0.01,0.04%,950317719,United States,2018,16207,Finance,Life Insurance
PRSP,Perspecta Inc. Common Stock ,$26.25,-0.29,-1.09%,4225297073,,1998,723125,Technology,EDP Services
PRSRU,Prospector Capital Corp. Unit,$11.25,-0.29,-2.51%,0,United States,2021,362375,Finance,Business Services
PRT,PermRock Royalty Trust Trust Units,$3.17,0,0.00%,38565370,United States,2018,10341,Energy,Oil & Gas Production
PRTA,Prothena Corporation plc Ordinary Shares,$13.26,-0.51,-3.70%,529357936,United States,,237765,Health Care,Major Pharmaceuticals
PRTC,PureTech Health plc American Depositary Shares,$56.49,3.49,6.59%,1614964478,United Kingdom,,3898,Health Care,Major Pharmaceuticals
PRTH,Priority Technology Holdings Inc. Common Stock,$7.70,0.02,0.26%,517590373,United States,2016,99261,Miscellaneous,Business Services
PRTK,Paratek Pharmaceuticals Inc. Common Stock,$6.795,0.035,0.52%,310131995,United States,,260528,Health Care,Major Pharmaceuticals
PRTS,CarParts.com Inc. Common Stock,$20.18,6.56,48.16%,954929022,United States,2007,34635209,Consumer Services,Other Specialty Stores
PRTY,Party City Holdco Inc. Common Stock,$7.27,-0.15,-2.02%,804397511,United States,2015,2659820,Consumer Services,Other Specialty Stores
PRU,Prudential Financial Inc. Common Stock,$81.22,-0.74,-0.90%,32163120000,United States,2001,1642315,Finance,Life Insurance
PRVB,Provention Bio Inc. Common Stock,$14.12,-0.41,-2.82%,885859021,United States,2018,974416,Health Care,Major Pharmaceuticals
PS,Pluralsight Inc. Class A Common Stock,$20.94,0.04,0.19%,3087164160,United States,2018,1878932,Technology,Computer Software: Programming Data Processing
PSA,Public Storage Common Stock,$227.84,2.02,0.90%,39831476833,United States,,825918,Consumer Services,Real Estate Investment Trusts
PSA.PRC,Public Storage,NA,,,,,,0,,
PSA.PRD,Public Storage,NA,,,,,,0,,
PSA.PRE,Public Storage,NA,,,,,,0,,
PSA.PRF,Public Storage,NA,,,,,,0,,
PSA.PRG,Public Storage,NA,,,,,,0,,
PSA.PRH,Public Storage,NA,,,,,,0,,
PSA.PRI,Public Storage,NA,,,,,,0,,
PSA.PRJ,Public Storage,NA,,,,,,0,,
PSA.PRK,Public Storage,NA,,,,,,0,,
PSA.PRL,Public Storage,NA,,,,,,0,,
PSA.PRM,Public Storage,NA,,,,,,0,,
PSA.PRN,Public Storage,NA,,,,,,0,,
PSA.PRO,Public Storage,NA,,,,,,0,,
PSAC,Property Solutions Acquisition Corp. Common Stock,$13.23,1.81,15.85%,390503441,United States,2020,5243233,Finance,Business Services
PSACU,Property Solutions Acquisition Corp. Unit,$15.75,1.83,13.15%,0,United States,2020,344031,Finance,Business Services
PSACW,Property Solutions Acquisition Corp. Warrant,$2.65,0.06,2.32%,0,United States,2020,1747061,Finance,Business Services
PSB,PS Business Parks Inc. Common Stock,$138.15,0.24,0.17%,3797542768,United States,,53219,Consumer Services,Real Estate Investment Trusts
PSB.PRW,PS Business Parks Inc.,NA,,,,,,0,,
PSB.PRX,PS Business Parks Inc.,NA,,,,,,0,,
PSB.PRY,PS Business Parks Inc.,NA,,,,,,0,,
PSB.PRZ,PS Business Parks Inc.,NA,,,,,,0,,
PSCX,Pacer Swan SOS Conservative (December) ETF,$20.927,-0.0127,-0.06%,,United States,2020,6,,
PSEC,Prospect Capital Corporation Common Stock,$6.45,0.18,2.87%,2454821902,United States,2004,2707014,,
PSF,Cohen & Steers Select Preferred and Income Fund Inc. Common Stock,$26.55,0.12,0.45%,318932857,,2010,24053,,
PSFD,Pacer Funds ETF,$21.1657,-0.0291,-0.14%,,United States,2020,4551,,
PSFF,Pacer Swan SOS Fund of Funds ETF,$20.6343,-0.0198,-0.10%,,United States,2020,9004,,
PSHG,Performance Shipping Inc. Common Shares,$5.57,0.04,0.72%,27936341,Greece,,43099,Transportation,Marine Transportation
PSMD,Pacer Swan SOS Moderate (December) ETF,$20.9894,-0.0186,-0.09%,,United States,2020,6281,,
PSMT,PriceSmart Inc. Common Stock,$98.16,1.44,1.49%,3017274865,United States,,99665,Consumer Services,Department/Specialty Retail Stores
PSN,Parsons Corporation Common Stock,$38.65,-0.35,-0.90%,3893103149,,2019,231845,Technology,EDP Services
PSNL,Personalis Inc. Common Stock,$42.47,-4.44,-9.47%,1653476228,United States,2019,846862,Health Care,Medical Specialities
PSO,Pearson Plc Common Stock,$10.48,0.66,6.72%,7894140046,United Kingdom,,544693,Consumer Services,Books
PSTG,Pure Storage Inc. Class A Common Stock,$22.51,-0.73,-3.14%,6140975362,,2015,2695261,Technology,Electronic Components
PSTH,Pershing Square Tontine Holdings Ltd. Class A Common Stock,$27.51,-0.39,-1.40%,5502002751,,2020,3796968,Finance,Business Services
PSTH.WS,Pershing Square Tontine Holdings Ltd. Warrants exercisable for one share of Class A Common Stock for $23.00 per share,NA,,,,,,0,,
PSTI,Pluristem Therapeutics Inc. Common Stock,$7.30,-0.15,-2.01%,187123696,Israel,,367412,Health Care,Biotechnology: Biological Products (No Diagnostic Substances)
PSTL,Postal Realty Trust Inc. Class A Common Stock,$16.32,0.09,0.56%,215653427,,2019,52259,Consumer Services,Real Estate Investment Trusts
PSTV,PLUS THERAPEUTICS Inc. Common Stock ,$2.75,-0.34,-11.00%,13143856,United States,,1405530,Health Care,Medical/Dental Instruments
PSTX,Poseida Therapeutics Inc. Common Stock,$8.84,-0.24,-2.64%,546488888,United States,2020,217342,Health Care,Biotechnology: Biological Products (No Diagnostic Substances)
PSX,Phillips 66 Common Stock,$71.31,-0.77,-1.07%,31148221192,United States,,2056790,Energy,Integrated oil Companies
PSXP,Phillips 66 Partners LP Common Units representing limited partner interest in the Partnership,$28.81,-0.53,-1.81%,6578479606,United States,2013,2481894,Energy,Natural Gas Distribution
PT,Pintec Technology Holdings Limited American Depositary Shares,$1.24,-0.05,-3.88%,53491437,China,2018,1567024,Technology,Computer Software: Programming Data Processing
PTA,Cohen & Steers Tax-Advantaged Preferred Securities and Income Fund Common Shares of Beneficial Interest,$25.04,-0.15,-0.60%,0,,2020,110659,,
PTC,PTC Inc. Common Stock,$129.52,-1.36,-1.04%,15110161711,United States,,698737,Technology,Computer Software: Prepackaged Software
PTCT,PTC Therapeutics Inc. Common Stock,$61.18,-2.34,-3.68%,4174662512,United States,2013,248503,Health Care,Major Pharmaceuticals
PTE,PolarityTE Inc. Common Stock,$0.9958,-0.0242,-2.37%,66522250,United States,,6181329,Health Care,Biotechnology: Biological Products (No Diagnostic Substances)
PTEN,Patterson-UTI Energy Inc. Common Stock,$5.91,-0.32,-5.14%,1108088210,United States,1993,2051657,Energy,Oil & Gas Production
PTGX,Protagonist Therapeutics Inc. Common Stock,$23.09,-0.54,-2.29%,993301691,United States,2016,272696,Health Care,Major Pharmaceuticals
PTIC,PropTech Investment Corporation II Class A Common Stock,$10.33,-0.1128,-1.08%,0,United States,2021,89273,Finance,Business Services
PTICU,PropTech Investment Corporation II Unit,$10.77,-0.14,-1.28%,0,United States,2020,230179,Finance,Business Services
PTICW,PropTech Investment Corporation II Warrant,$1.835,-0.665,-26.60%,0,United States,2021,36628,Finance,Business Services
PTK,PTK Acquisition Corp. Common Stock,$10.37,-0.18,-1.71%,149068750,United States,2020,42517,Finance,Business Services
PTK.U,PTK Acquisition Corp. Units,NA,,,,United States,2020,0,,
PTK.WS,PTK Acquisition Corp. Warrants each whole warrant exercisable for one half (1/2) of a share of Common Stock at an exercise price of $11.50,NA,,,,United States,,0,,
PTMN,Portman Ridge Finance Corporation Common Stock,$1.94,-0.01,-0.51%,136118606,United States,,177710,,
PTN,Palatin Technologies Inc. Common Stock,$1.00,-0.06,-5.66%,229901307,United States,,9869716,Health Care,Major Pharmaceuticals
PTNR,Partner Communications Company Ltd. American Depositary Shares,$4.77,0.17,3.70%,876350911,Israel,,3449,Public Utilities,Telecommunications Equipment
PTON,Peloton Interactive Inc. Class A Common Stock,$147.79,-9.35,-5.95%,43233367091,United States,2019,6664735,Energy,Consumer Electronics/Appliances
PTPI,Petros Pharmaceuticals Inc. Common Stock,$3.95,-0.06,-1.50%,38345585,United States,,13387,Health Care,Major Pharmaceuticals
PTR,PetroChina Company Limited Common Stock,$31.19,-0.73,-2.29%,57084242976,China,,243160,Energy,Oil & Gas Production
PTRS,Partners Bancorp Common Stock,$6.45,0.01,0.16%,114875874,United States,,38499,Finance,Major Banks
PTSI,P.A.M. Transportation Services Inc. Common Stock,$55.12,-0.98,-1.75%,316086301,United States,1986,10209,Transportation,Trucking Freight/Courier Services
PTVCA,Protective Insurance Corporation Class A Common Stock,$15.83,-0.42,-2.59%,225828675,United States,,4476,Finance,Property-Casualty Insurers
PTVCB,Protective Insurance Corporation Class B Common Stock,$14.40,-0.14,-0.96%,205428485,United States,,18881,Finance,Property-Casualty Insurers
PTVE,Pactiv Evergreen Inc. Common stock,$15.40,-0.27,-1.72%,2728228734,United States,2020,146308,Consumer Durables,Containers/Packaging
PTY,Pimco Corporate & Income Opportunity Fund,$17.97,0.02,0.11%,1908435834,United States,2002,328995,,
PUBM,PubMatic Inc. Class A Common Stock,$37.66,-0.2,-0.53%,1801146141,United States,2020,234885,Technology,Computer Software: Programming Data Processing
PUK,Prudential Public Limited Company Common Stock,$37.79,0.29,0.77%,49306307919,United Kingdom,,157686,Finance,Life Insurance
PUK.PR,Prudential Public Limited Company,NA,,,,,,0,,
PUK.PRA,Prudential Public Limited Company,NA,,,,,,0,,
PULM,Pulmatrix Inc. Common Stock,$1.53,-0.09,-5.56%,52643449,United States,2014,1439456,Health Care,Major Pharmaceuticals
PUMP,ProPetro Holding Corp. Common Stock,$8.23,0.18,2.24%,830512155,United States,2017,1887111,Energy,Oilfield Services/Equipment
PUYI,Puyi Inc. American Depository Shares,$6.02,-0.17,-2.75%,363094350,China,2019,2697,Finance,Investment Managers
PV.U,Primavera Capital Acquisition Corporation Units each consisting of one Class A ordinary share and one-half of one redeemable warrant,NA,,,,,2021,0,,
PVAC,Penn Virginia Corporation Common Stock,$10.58,-0.54,-4.86%,160820602,United States,,511555,Energy,Oil & Gas Production
PVBC,Provident Bancorp Inc. (MD) Common Stock,$11.67,-0.35,-2.91%,226691395,United States,2015,27515,Finance,Savings Institutions
PVG,Pretium Resources Inc. Ordinary Shares (Canada),$10.40,-0.02,-0.19%,1947438927,Canada,,920689,Basic Industries,Precious Metals
PVH,PVH Corp. Common Stock,$91.52,-4.33,-4.52%,6507094880,United States,,960922,Consumer Non-Durables,Apparel
PVL,Permianville Royalty Trust Trust Units ,$1.05,-0.03,-2.78%,34650000,United States,2011,107709,Energy,Oil & Gas Production
PW,Power REIT (MD) Common Stock,$32.18,-0.86,-2.60%,61661353,United States,,41084,Consumer Services,Real Estate Investment Trusts
PW.PRA,Power REIT,NA,,,,,,0,,
PWFL,PowerFleet Inc. Common Stock,$8.63,0.7,8.83%,268401147,United States,,281397,Capital Goods,Telecommunications Equipment
PWOD,Penns Woods Bancorp Inc. Common Stock,$22.48,-0.63,-2.73%,158524082,United States,,9189,Finance,Major Banks
PWR,Quanta Services Inc. Common Stock,$74.84,-0.88,-1.16%,10392349756,United States,,698438,Capital Goods,Engineering & Construction
PXD,Pioneer Natural Resources Company Common Stock,$123.64,-5.69,-4.40%,26731844113,United States,,2102643,Energy,Oil & Gas Production
PXLW,Pixelworks Inc.  Common Stock,$3.39,0.01,0.30%,172453378,United States,2000,449838,Technology,Semiconductors
PXS,Pyxis Tankers Inc. Common Stock,$1.04,-0.04,-3.70%,22422280,Greece,,385023,Transportation,Marine Transportation
PXSAP,Pyxis Tankers Inc. 7.75% Series A Cumulative Convertible Preferred Shares,$15.5495,-0.1169,-0.75%,0,Greece,,200,Transportation,Marine Transportation
PXSAW,Pyxis Tankers Inc. Warrant,$0.3042,-0.0008,-0.26%,0,Greece,,4089,Transportation,Marine Transportation
PYN,PIMCO New York Municipal Income Fund III Common Shares of Beneficial Interest,$9.05,0.07,0.78%,51839224,United States,2002,10764,,
PYPD,PolyPid Ltd. Ordinary Shares,$9.90,-0.38,-3.70%,183094006,Israel,2020,191093,Health Care,Medical/Dental Instruments
PYPL,PayPal Holdings Inc. Common Stock,$241.00,-6.75,-2.73%,2.82378E+11,United States,,7882985,Miscellaneous,Business Services
PYS,Merrill Lynch Depositor Inc PPlus Tr Ser RRD-1 Tr Ctf Cl A,$22.25,0.25,1.14%,0,United States,,3528,Finance,Finance: Consumer Services
PYT,PPlus Tr GSC-2 Tr Ctf Fltg Rate,$23.79,0,0.00%,0,United States,,90,Finance,Finance: Consumer Services
PZC,PIMCO California Municipal Income Fund III Common Shares of Beneficial Interest,$10.37,0.01,0.10%,232015642,United States,2002,24173,,
PZG,Paramount Gold Nevada Corp. Common Stock,$1.10,-0.02,-1.79%,37716458,United States,2015,145099,Basic Industries,Precious Metals
PZN,Pzena Investment Management Inc Class A Common Stock,$8.46,0.01,0.12%,602097921,United States,2007,44823,Finance,Investment Managers
PZZA,Papa John's International Inc. Common Stock,$102.04,4.6,4.72%,3362440855,United States,1993,474552,Consumer Services,Restaurants
QADA,QAD Inc. Class A Common Stock,$67.00,0.26,0.39%,1386838159,United States,,59862,Technology,Computer Software: Prepackaged Software
QADB,QAD Inc. Class B Common Stock,$48.0401,-0.8999,-1.84%,994385729,United States,,267,Technology,Computer Software: Prepackaged Software
QCOM,QUALCOMM Incorporated Common Stock,$162.55,-1.85,-1.13%,1.84617E+11,United States,1991,6554240,Technology,Radio And Television Broadcasting And Communications Equipment
QCRH,QCR Holdings Inc. Common Stock,$39.87,-0.2,-0.50%,629681144,United States,,45476,Finance,Major Banks
QD,Qudian Inc. American Depositary Shares each representing one Class A Ordinary Share,$2.15,0.04,1.90%,545518100,China,2017,4807099,Finance,Finance: Consumer Services
QDEC,FT Cboe Vest Growth-100 Buffer ETF - December,$20.50,0.055,0.27%,,United States,2020,80871,,
QDEL,Quidel Corporation Common Stock,$226.18,-12.31,-5.16%,9514860172,United States,,720866,Health Care,Biotechnology: In Vitro & In Vivo Diagnostic Substances
QELL,Qell Acquisition Corp. Class A Ordinary Shares,$13.64,-0.02,-0.15%,647047500,United States,2020,1052096,Finance,Business Services
QELLU,Qell Acquisition Corp. Unit,$14.76,-0.08,-0.54%,0,United States,2020,187288,Finance,Business Services
QELLW,Qell Acquisition Corp. Warrant,$3.45,-0.12,-3.36%,0,United States,2020,363509,Finance,Business Services
QEP,QEP Resources Inc. Common Stock,$2.95,-0.08,-2.64%,716660138,United States,,4893717,Energy,Oil & Gas Production
QFIN,360 DigiTech Inc. American Depositary Shares,$16.08,-0.33,-2.01%,2445953692,China,2018,1335896,Finance,Finance: Consumer Services
QGEN,Qiagen N.V. Common Shares ,$52.38,-1.47,-2.73%,11981872620,Netherlands,,809244,Health Care,Biotechnology: Biological Products (No Diagnostic Substances)
QH,Quhuo Limited American Depository Shares,$8.68,0.89,11.43%,450547639,China,2020,329262,Miscellaneous,Business Services
QIWI,QIWI plc American Depositary Shares,$10.21,-0.02,-0.20%,640299475,Cyprus,2013,481912,Miscellaneous,Business Services
QK,Q&K International Group Limited American Depositary Shares,$3.60,0.83,29.96%,172321301,China,2019,1518490,Finance,Real Estate
QLGN,Qualigen Therapeutics Inc. Common Stock,$3.54,0.06,1.72%,94542953,United States,2015,1334289,Health Care,Major Pharmaceuticals
QLI,Qilian International Holding Group Ltd. Ordinary Shares,$8.02,-0.27,-3.26%,280700000,China,2021,395191,Health Care,Major Pharmaceuticals
QLYS,Qualys Inc. Common Stock,$131.72,0.3,0.23%,5139265367,United States,2012,384803,Technology,Computer Software: Prepackaged Software
QMCO,Quantum Corporation Common Stock,$7.01,-0.08,-1.13%,285588886,United States,,115694,Technology,Electronic Components
QNST,QuinStreet Inc. Common Stock,$22.09,0.14,0.64%,1168412533,United States,2010,302300,Miscellaneous,Business Services
QQQX,Nuveen NASDAQ 100 Dynamic Overwrite Fund Shares of Beneficial Interest,$26.93,-0.04,-0.15%,1102963258,United States,,112068,,
QRHC,Quest Resource Holding Corporation Common Stock,$2.7122,-0.0328,-1.20%,49853564,United States,,80005,Technology,Diversified Commercial Services
QRTEA,Qurate Retail Inc. Series A Common Stock ,$13.02,0.86,7.07%,5432223787,United States,,4405608,Consumer Services,Catalog/Specialty Distribution
QRTEB,Qurate Retail Inc. Series B Common Stock ,$13.00,0.86,7.08%,5423879357,United States,,18022,Consumer Services,Catalog/Specialty Distribution
QRTEP,Qurate Retail Inc. 8.0% Fixed Rate Cumulative Redeemable Preferred Stock,$100.73,0.22,0.22%,0,United States,,67924,Consumer Services,Catalog/Specialty Distribution
QRVO,Qorvo Inc. Common Stock,$174.94,-5.98,-3.31%,19952624604,United States,,1021455,Technology,Semiconductors
QS,QuantumScape Corporation Class A Common Stock,$47.27,-0.36,-0.76%,17204403570,United States,2020,12089846,Miscellaneous,Industrial Machinery/Components
QS.WS,QuantumScape Corporation Warrants,NA,,,,United States,,0,,
QSR,Restaurant Brands International Inc. Common Shares,$59.70,0.64,1.08%,18095861562,Canada,2014,1262272,Consumer Services,Restaurants
QTNT,Quotient Limited Ordinary Shares,$5.93,-0.22,-3.58%,599058794,Switzerland,2014,407584,Health Care,Biotechnology: In Vitro & In Vivo Diagnostic Substances
QTRX,Quanterix Corporation Common Stock,$66.47,-9.72,-12.76%,2104984190,United States,2017,565202,Capital Goods,Biotechnology: Laboratory Analytical Instruments
QTS,QTS Realty Trust Inc. Class A Common Stock,$66.99,0.99,1.50%,4316534413,United States,2013,609058,Consumer Services,Real Estate Investment Trusts
QTS.PRA,QTS Realty Trust Inc.,NA,,,,,,0,,
QTS.PRB,QTS Realty Trust Inc.,NA,,,,,,0,,
QTT,Qutoutiao Inc. American Depositary Shares,$3.36,-0.09,-2.61%,896535535,China,2018,9397066,Technology,Computer Software: Programming Data Processing
QTWO,Q2 Holdings Inc. Common Stock,$139.32,0.7,0.51%,7507003105,,2014,481370,Technology,Computer Software: Prepackaged Software
QUAD,Quad Graphics Inc Class A Common Stock,$4.39,0.21,5.02%,235552079,United States,,376857,Miscellaneous,Publishing
QUIK,QuickLogic Corporation Common Stock,$4.24,-0.19,-4.29%,46930351,United States,1999,118197,Technology,Semiconductors
QUMU,Qumu Corporation Common Stock,$7.46,-0.64,-7.90%,103184221,United States,,190476,Technology,Computer Software: Prepackaged Software
QUOT,Quotient Technology Inc. Common Stock,$9.84,-0.28,-2.77%,895494691,,2014,350946,Consumer Services,Advertising
QURE,uniQure N.V. Ordinary Shares,$38.25,-1.51,-3.80%,1701977393,Netherlands,2014,400177,Health Care,Major Pharmaceuticals
QVCC,QVC Inc. 6.250% Senior Secured Notes due 2068,$25.15,-0.05,-0.20%,0,United States,2019,50039,Consumer Services,Catalog/Specialty Distribution
QVCD,QVC Inc. 6.375% Senior Secured Notes due 2067,$25.68,0.095,0.37%,0,United States,2018,12961,Consumer Services,Catalog/Specialty Distribution
R,Ryder System Inc. Common Stock,$66.65,-0.54,-0.80%,3591710048,United States,,465522,Consumer Services,Rental/Leasing Companies
RA,Brookfield Real Assets Income Fund Inc. Common Stock,$18.57,0.09,0.49%,815043112,,2016,250080,,
RAACU,Revolution Acceleration Acquisition Corp Unit,$11.00,-0.04,-0.36%,0,United States,2020,278195,Finance,Business Services
